{
  "name": "web.webhooks",
  "version": "1.0.1",
  "main": "src/index.kn",
  "dependencies": {
    "web.httpplus": "^1.0.0",
    "sec.crypto": "^1.0.0",
    "sys.log": "^1.0.0"
  },
  "trusted": false,
  "dist": {
    "tarball": "https://github.com/entrenchedosx/kern/releases/download/web.webhooks-v1.0.1/web.webhooks-1.0.1.tgz",
    "shasum": "sha256-5bf6b41b37fa6800e36b62080987419c69c0bdf0812c1ccf4a2d00f7bcf2f1e1"
  }
}
